{
  "$schema": "https://json-schema.org/draft/2020-12/schema",
  "$id": "https://srs.semanticops.com/schema/2.0/container.json",
  "title": "SRS Container",
  "description": "A lightweight grouping boundary over a collection of instances. Containers answer scoping questions — which instances belong together — that the Relation graph alone cannot answer.",
  "type": "object",
  "required": ["containerId", "title"],
  "additionalProperties": false,
  "properties": {
    "$schema": {
      "type": "string",
      "const": "https://srs.semanticops.com/schema/2.0/container.json"
    },
    "containerId": {
      "type": "string",
      "description": "Stable UUID for this Container. Must not appear in Relation.sourceInstanceId or targetInstanceId."
    },
    "title": {
      "type": "string",
      "description": "Human-readable label for this Container."
    },
    "namespace": {
      "type": "string",
      "description": "Optional namespace grouping."
    },
    "name": {
      "type": "string",
      "description": "Optional machine-readable name within the namespace."
    },
    "description": {
      "type": "string",
      "description": "Optional description of the Container's purpose."
    },
    "containerType": {
      "type": "string",
      "deprecated": true,
      "description": "Soft-deprecated hint (RFC-009). When rootInstanceIds is present, SHOULD equal the resolved root Type's name field (bare name, not namespace/name). A mismatch is diagnostic-only; the Container remains valid. See RFC-009 I-64."
    },
    "rootInstanceIds": {
      "type": "array",
      "items": { "type": "string", "format": "uuid" },
      "description": "Top-level instances this Container was created to hold. Implementations may derive nested members by traversing contains Relations from these roots."
    },
    "memberInstanceIds": {
      "type": "array",
      "items": { "type": "string", "format": "uuid" },
      "description": "Explicit membership list for all instances in scope. When present, allows membership queries without graph traversal."
    },
    "identityInstanceId": {
      "type": "string",
      "format": "uuid",
      "description": "RFC-013 / RFC-029. The instance id of the record that is this Container's identity / purpose statement. On the root container (manifest.container), names the repository's identity record. Reassignable; when present MUST equal a member id in rootInstanceIds or memberInstanceIds (RFC-013 I-81). RFC-029 additionally requires that on the root container (manifest.container), this MUST reference a Tier-2 Record of type com.semanticops.core/purpose (RFC-029 I-87); for non-root containers this type constraint does not apply. See RFC-013 I-81, RFC-029 R5."
    },
    "tags": {
      "type": "array",
      "items": { "type": "string" },
      "description": "Vocabulary-backed topic labels (RFC-009 + RFC-006). When a Vocabulary in the package declares Terms for a tag key, tags MUST resolve per RFC-006 vocabulary resolution rules. Free-string tags are valid when no Vocabulary governs the key."
    },
    "createdAt": {
      "type": "string",
      "format": "date-time"
    },
    "updatedAt": {
      "type": "string",
      "format": "date-time"
    },
    "meta": {
      "type": "object",
      "description": "Implementation-local metadata. Cross-system keys should be namespaced."
    }
  }
}
